{
  "$comment": "EXEMPLE — Audience fictive Lumya. Montre à quoi ressemble un profile.json rempli.",
  "_schema": "brand/L3-audience",
  "_version": "1.2",
  "_field_types": {
    "identity.*": "structured",
    "role.*": "structured",
    "psychology.*": "structured",
    "psychology.jtbd.*": "structured",
    "decision_process.*": "structured",
    "behavior.*": "structured",
    "voice.*": "observed",
    "voice.key_expressions": "observed",
    "pain_points[].formulation": "observed",
    "pain_points[].chain": "structured",
    "pain_points[].emotion": "observed",
    "pain_points[].trigger": "observed",
    "benefits[].formulation": "observed",
    "benefits[].chain": "structured",
    "objections[].formulation": "observed",
    "objections[].type": "structured",
    "objections[].frequency": "structured",
    "objections[].severity": "structured",
    "objections[].lifecycle_stage": "structured",
    "market_position.*": "structured",
    "research_meta.*": "observed"
  },

  "meta": {
    "name": "Femmes actives 40-55",
    "slug": "femmes-40-55",
    "product_id": "creme-eclat",
    "status": "complete",
    "created": "2026-01-10",
    "updated": "2026-04-03"
  },

  "identity": {
    "description": "Femme active, CSP+, 40-55 ans, urbaine. Travaille en bureau ou profession libérale. Consommatrice éduquée, sceptique des promesses marketing mais prête à investir si la preuve est là.",
    "archetype": "la pragmatique exigeante",
    "age_range": { "min": 40, "max": 55 },
    "gender": "female",
    "profession_category": "cadre / profession libérale / cheffe d'entreprise",
    "income_level": "high",
    "lifestyle": ["active professionnellement", "peu de temps pour elle", "voyages réguliers", "sport modéré"],
    "information_sources": ["Instagram", "bouche-à-oreille amies", "dermatologue", "articles Madame Figaro", "Amazon reviews"]
  },

  "role": {
    "type": "end_user",
    "proxy_link_id": null
  },

  "psychology": {
    "core_desire": "rester elle-même malgré le temps qui passe — pas paraître plus jeune, mais rester reconnue",
    "values": ["authenticité", "efficacité", "preuves concrètes", "temps = ressource rare"],
    "goals": ["avoir une peau qui lui ressemble encore", "simplifier sa routine sans sacrifier l'efficacité", "ne plus avoir à se maquiller pour se sentir présentable"],
    "beliefs_limiting": [
      "Les crèmes anti-âge c'est du marketing, ça ne marche vraiment pas",
      "Pour avoir de vrais résultats il faut aller chez le dermato",
      "À mon âge c'est trop tard pour changer grand chose"
    ],
    "beliefs_facilitating": [
      "Si c'est prouvé cliniquement et formulé correctement, ça peut marcher",
      "Je mérite d'investir dans ma peau",
      "Je connais mon visage — je saurais voir une vraie différence"
    ],
    "emotions": ["frustration devant les promesses non tenues", "nostalgie de sa peau d'avant", "désir de contrôle", "méfiance"],
    "social_codes": ["discret sur ses soins beauté", "ne veut pas paraître obsédée par son âge", "partage ses bons plans aux amies proches"],
    "life_moments": ["retour après vacances (photos qui font peur)", "anniversaire rond (50 ans)", "photo de groupe event pro"],
    "jtbd": {
      "primary": "Avoir une peau qui lui ressemble encore sans y consacrer plus de 5 minutes par matin",
      "context": "Le matin avant le travail, ou le soir après une longue journée — elle a peu de temps",
      "emotional_driver": "identity"
    }
  },

  "decision_process": {
    "awareness_trigger": "Photo ou miroir qui révèle une différence qu'elle ne peut plus ignorer — rides profondes, teint terne, taches visibles",
    "research_behavior": {
      "primary_sources": ["Instagram (before/after)", "Avis Amazon vérifiés", "Recommandation dermatologue ou amie"],
      "secondary_sources": ["Articles presse féminine", "YouTube reviews dermatologues"],
      "decision_makers": "self"
    },
    "evaluation_criteria": ["preuves cliniques (chiffres)", "avis clients vérifiés volume", "ingrédients actifs lisibles", "marque credible (dermo endorsement)"],
    "trust_anchors": ["étude clinique citée", "dermatologue qui valide", "% clientes satisfaites élevé", "30j satisfait ou remboursé"],
    "purchase_catalyst": "Promotion limitée + preuve sociale forte (avis) + garantie remboursement",
    "risk_tolerance": "needs_consensus"
  },

  "behavior": {
    "purchase_frequency": "occasional",
    "conversion_timeline": "considered",
    "dominant_device": "mobile",
    "cart_behavior": "comparison_shops",
    "seasonal_spikes": ["septembre (rentrée, remise en forme)", "janvier (bonnes résolutions)", "avant été (préparer la peau)"],
    "channel_preferences": ["instagram ads", "search google", "email (si déjà cliente)"]
  },

  "voice": {
    "vocabulary_to_use": ["vraiment efficace", "résultats visibles", "cliniquement prouvé", "j'ai vu la différence", "ça tient ses promesses"],
    "vocabulary_to_avoid": ["révolutionnaire", "rajeunissez", "anti-rides miracle", "paraître plus jeune"],
    "key_expressions": [
      "j'en ai essayé tellement qui ne marchaient pas",
      "je veux juste que ça fasse ce que ça dit",
      "j'ai l'air fatiguée même quand je le suis pas",
      "c'est pas l'âge qui me dérange, c'est de ne plus me reconnaître",
      "j'ai pas le temps pour une routine de 12 étapes"
    ],
    "tone_register": "direct, preuves concrètes, pas de superlatifs"
  },

  "pain_points": [
    {
      "ref": "PROB-01",
      "priority": 1,
      "formulation": "J'ai essayé des dizaines de crèmes anti-âge et aucune ne fait vraiment ce qu'elle promet",
      "chain": [
        { "level": "surface", "formulation": "Mon placard est plein de produits à moitié utilisés qui ont déçu" },
        { "level": "consequence", "formulation": "Je gaspille de l'argent et je perds confiance dans les marques de soin" },
        { "level": "deep", "formulation": "J'ai l'impression de ne rien pouvoir faire contre ce que je vois dans mon miroir" }
      ],
      "emotion": "frustration + résignation",
      "trigger": "Voir une nouvelle crème promouvoir des résultats similaires aux précédentes"
    },
    {
      "ref": "PROB-02",
      "priority": 2,
      "formulation": "Mon teint est devenu terne et j'ai des taches brunes que le fond de teint ne cache plus",
      "chain": [
        { "level": "surface", "formulation": "J'ai l'air fatiguée même après une bonne nuit de sommeil" },
        { "level": "consequence", "formulation": "Je ne sors plus sans maquillage, même pour faire des courses" },
        { "level": "deep", "formulation": "Je ne me reconnais plus dans le miroir — c'est perturbant" }
      ],
      "emotion": "honte discrète + nostalgie",
      "trigger": "Photo spontanée ou réunion en visio avec la webcam allumée"
    }
  ],

  "benefits": [
    {
      "ref": "BEN-01",
      "priority": 1,
      "formulation": "Des rides vraiment réduites, pas juste 'atténuées' avec des chiffres vagues",
      "chain": [
        { "level": "functional", "formulation": "Je vois objectivement mes rides de surface s'estomper en quelques semaines" },
        { "level": "emotional", "formulation": "Je retrouve de la confiance dans ce que je vois le matin" },
        { "level": "identity", "formulation": "Je vieillis, mais à mon rythme — pas celui que j'avais peur de voir" }
      ],
      "emotional_lever": "identity"
    },
    {
      "ref": "BEN-02",
      "priority": 2,
      "formulation": "Un éclat naturel qui m'évite le fond de teint au quotidien",
      "chain": [
        { "level": "functional", "formulation": "Mon teint s'uniformise, je sors sans maquillage sans me sentir 'nue'" },
        { "level": "emotional", "formulation": "Je gagne 10 minutes le matin et je pars au boulot en confiance" },
        { "level": "identity", "formulation": "Je n'ai plus besoin de me cacher pour me sentir moi-même" }
      ],
      "emotional_lever": "relief"
    }
  ],

  "objections": [
    {
      "type": "scepticisme",
      "formulation": "J'ai déjà essayé des crèmes avec rétinol et ça n'a rien fait de spécial",
      "frequency": 9,
      "severity": "high",
      "lifecycle_stage": "consideration"
    },
    {
      "type": "prix",
      "formulation": "68€ c'est cher pour une crème qui peut décevoir comme les autres",
      "frequency": 7,
      "severity": "medium",
      "lifecycle_stage": "decision"
    },
    {
      "type": "scepticisme",
      "formulation": "Les études cliniques des marques c'est souvent biaisé ou fait sur 10 personnes",
      "frequency": 6,
      "severity": "high",
      "lifecycle_stage": "consideration"
    },
    {
      "type": "temps",
      "formulation": "Je vais devoir attendre des mois avant de voir quoi que ce soit",
      "frequency": 5,
      "severity": "medium",
      "lifecycle_stage": "consideration"
    }
  ],

  "market_position": {
    "awareness_level": "problem_aware",
    "sophistication_override": null
  },

  "research_meta": {
    "confidence": 78,
    "opportunity_score": 8,
    "sources_used": ["120 avis Amazon vérifiés Lumya", "50 avis Trustpilot", "3 interviews clients", "Reddit r/SkincareAddiction FR"]
  }
}
